<!ELEMENT partidos (resultados+)>
<!ELEMENT resultados (nombre_local,nombre_visitante,goles_local,goles_visitante)>
<!ELEMENT nombre_local (#PCDATA)>
<!ELEMENT nombre_visitante (#PCDATA)>
<!ELEMENT goles_local (#PCDATA)>
<!ELEMENT goles_visitante (#PCDATA)>
